<?xml version="1.0" encoding="utf-8"?>
<HSCOrgRefData:OrgRefData xmlns:HSCOrgRefData="http://refdata.hscic.gov.uk/org/v2-0-0" xmlns:xsi="http://www.w3.org/2001/XMLSchema-instance" xsi:schemaLocation="http://refdata.hscic.gov.uk/org/v2-0-0 HSCOrgRefData.xsd">
  <Manifest>
    <Version value="2-0-0" />
    <PublicationType value="Full" />
    <PublicationSource value="HSCIC" />
    <PublicationDate value="2022-07-25" />
    <PublicationSeqNum value="1755" />
    <FileCreationDateTime value="2022-07-25T22:14:25" />
    <RecordCount value="278411" />
    <ContentDescription value="HSCOrgRefData_Full_20220725" />
    <PrimaryRoleScope>
      <PrimaryRole id="RO180" displayName="PRIMARY CARE TRUST SITE" />
      <PrimaryRole id="RO198" displayName="NHS TRUST SITE" />
      <PrimaryRole id="RO157" displayName="NON-NHS ORGANISATION" />
      <PrimaryRole id="RO181" displayName="PHARMACY HEADQUARTER" />
      <PrimaryRole id="RO191" displayName="SPECIAL HEALTH AUTHORITY SITE" />
      <PrimaryRole id="RO96" displayName="BRANCH SURGERY" />
      <PrimaryRole id="RO108" displayName="CARE TRUST SITE" />
      <PrimaryRole id="RO175" displayName="PRISON" />
      <PrimaryRole id="RO107" displayName="CARE TRUST" />
      <PrimaryRole id="RO176" displayName="INDEPENDENT SECTOR H/C PROVIDER SITE" />
      <PrimaryRole id="RO122" displayName="LOCAL AUTHORITY SITE - LEGACY" />
      <PrimaryRole id="RO197" displayName="NHS TRUST" />
      <PrimaryRole id="RO173" displayName="PATHOLOGY LAB" />
      <PrimaryRole id="RO179" displayName="PRIMARY CARE TRUST" />
      <PrimaryRole id="RO167" displayName="OPTICAL SITE" />
      <PrimaryRole id="RO126" displayName="GOVERNMENT DEPARTMENT" />
      <PrimaryRole id="RO177" displayName="PRESCRIBING COST CENTRE" />
      <PrimaryRole id="RO166" displayName="OPTICAL HEADQUARTERS" />
      <PrimaryRole id="RO161" displayName="NHS SUPPORT AGENCY" />
      <PrimaryRole id="RO141" displayName="LOCAL AUTHORITY" />
      <PrimaryRole id="RO200" displayName="WELSH ASSEMBLY" />
      <PrimaryRole id="RO123" displayName="LOCAL AUTHORITY DEPARTMENT" />
      <PrimaryRole id="RO172" displayName="INDEPENDENT SECTOR HEALTHCARE PROVIDER" />
      <PrimaryRole id="RO142" displayName="LOCAL HEALTH BOARD" />
      <PrimaryRole id="RO146" displayName="LOCAL SERVICE PROVIDER (LSP)" />
      <PrimaryRole id="RO137" displayName="ISLE OF MAN GOVERNMENT DIRECTORATE" />
      <PrimaryRole id="RO140" displayName="ISLE OF MAN GOVERNMENT DIRECTORATE SITE" />
      <PrimaryRole id="RO148" displayName="LOCAL HEALTH BOARD SITE" />
      <PrimaryRole id="RO150" displayName="MILITARY HOSPITAL" />
      <PrimaryRole id="RO93" displayName="APPLICATION SERVICE PROVIDER - LEGACY" />
      <PrimaryRole id="RO110" displayName="GENERAL DENTAL PRACTICE" />
      <PrimaryRole id="RO105" displayName="CANCER REGISTRY" />
      <PrimaryRole id="RO128" displayName="GOVERNMENT OFFICE REGION" />
      <PrimaryRole id="RO189" displayName="SPECIAL HEALTH AUTHORITY (SPHA)" />
      <PrimaryRole id="RO92" displayName="APPLICATION SERVICE PROVIDER" />
      <PrimaryRole id="RO117" displayName="EDUCATION" />
      <PrimaryRole id="RO119" displayName="LOCAL AUTHORITY - LEGACY" />
      <PrimaryRole id="RO132" displayName="HEALTH AUTHORITY (HA)" />
      <PrimaryRole id="RO138" displayName="ISLE OF MAN GOVERNMENT DEPARTMENT" />
      <PrimaryRole id="RO91" displayName="EXECUTIVE AGENCY PROGRAMME" />
      <PrimaryRole id="RO134" displayName="HEALTH OBSERVATORY" />
      <PrimaryRole id="RO158" displayName="NON STATUTORY NHS ORGANISATION" />
      <PrimaryRole id="RO159" displayName="NATIONAL APPLICATION SERVICE PROVIDER" />
      <PrimaryRole id="RO89" displayName="EXECUTIVE AGENCY PROGRAMME - DEPARTMENT" />
      <PrimaryRole id="RO131" displayName="GOVERNMENT DEPARTMENT SITE" />
      <PrimaryRole id="RO147" displayName="LSP SITE" />
      <PrimaryRole id="RO116" displayName="EXECUTIVE AGENCY" />
      <PrimaryRole id="RO154" displayName="NORTHERN IRELAND HEALTH AND SOCIAL CARE TRUST" />
      <PrimaryRole id="RO162" displayName="OTHER STATUTORY AUTHORITY (OSA)" />
      <PrimaryRole id="RO103" displayName="CANCER NETWORK" />
      <PrimaryRole id="RO102" displayName="CLINICAL NETWORK" />
      <PrimaryRole id="RO185" displayName="REGIONAL OFFICE (RO)" />
      <PrimaryRole id="RO153" displayName="NORTHERN IRELAND HEALTH &amp; SOCIAL CARE BOARD" />
      <PrimaryRole id="RO90" displayName="EXECUTIVE AGENCY SITE" />
      <PrimaryRole id="RO136" displayName="STRATEGIC HEALTH AUTHORITY SITE" />
      <PrimaryRole id="RO155" displayName="NORTHERN IRELAND LOCAL COMMISSIONING GROUP" />
      <PrimaryRole id="RO98" displayName="CLINICAL COMMISSIONING GROUP" />
      <PrimaryRole id="RO168" displayName="OTHER STATUTORY AUTHORITY SITE" />
      <PrimaryRole id="RO210" displayName="NHS ENGLAND (REGION, LOCAL OFFICE)" />
      <PrimaryRole id="RO209" displayName="NHS ENGLAND (REGION)" />
      <PrimaryRole id="RO213" displayName="COMMISSIONING SUPPORT UNIT" />
      <PrimaryRole id="RO99" displayName="CLINICAL COMMISSIONING GROUP SITE" />
      <PrimaryRole id="RO214" displayName="COMMISSIONING SUPPORT UNIT SITE" />
      <PrimaryRole id="RO216" displayName="DATA SERVICES FOR COMMISSIONERS REGIONAL OFFICE (DSCRO)" />
      <PrimaryRole id="RO222" displayName="LOCAL AUTHORITY SITE" />
      <PrimaryRole id="RO212" displayName="NHS ENGLAND (REGION, LOCAL OFFICE) SITE" />
      <PrimaryRole id="RO217" displayName="DSCRO SITE" />
      <PrimaryRole id="RO230" displayName="SECURE TRAINING CENTRE" />
      <PrimaryRole id="RO231" displayName="SECURE CHILDREN'S HOME" />
      <PrimaryRole id="RO235" displayName="COURT" />
      <PrimaryRole id="RO234" displayName="POLICE CUSTODY SUITE" />
      <PrimaryRole id="RO233" displayName="CONSTABULARY" />
      <PrimaryRole id="RO228" displayName="YOUNG OFFENDER INSTITUTION" />
      <PrimaryRole id="RO232" displayName="IMMIGRATION REMOVAL CENTRE" />
      <PrimaryRole id="RO182" displayName="PHARMACY" />
      <PrimaryRole id="RO104" displayName="SOCIAL CARE PROVIDER" />
      <PrimaryRole id="RO101" displayName="SOCIAL CARE SITE" />
      <PrimaryRole id="RO94" displayName="APPLIANCE CONTRACTOR" />
      <PrimaryRole id="RO236" displayName="SEXUAL ASSAULT REFERRAL CENTRE" />
      <PrimaryRole id="RO261" displayName="STRATEGIC PARTNERSHIP" />
      <PrimaryRole id="RO272" displayName="PRIMARY CARE NETWORK" />
      <PrimaryRole id="RO280" displayName="PHARMACY SITE" />
      <PrimaryRole id="RO221" displayName="SCHOOL" />
      <PrimaryRole id="RO315" displayName="NORTHERN IRELAND GP PRACTICE" />
    </PrimaryRoleScope>
  </Manifest>
  <CodeSystems>
    <CodeSystem name="OrganisationRecordClass" oid="2.16.840.1.113883.2.1.3.2.4.23">
      <concept id="RC2" code="2" displayName="HSCSite" />
      <concept id="RC1" code="1" displayName="HSCOrg" />
    </CodeSystem>
    <CodeSystem name="OrganisationRole" oid="2.16.840.1.113883.2.1.3.2.4.17.507">
      <concept id="RO179" code="179" displayName="PRIMARY CARE TRUST" />
      <concept id="RO180" code="180" displayName="PRIMARY CARE TRUST SITE" />
      <concept id="RO197" code="197" displayName="NHS TRUST" />
      <concept id="RO198" code="198" displayName="NHS TRUST SITE" />
      <concept id="RO114" code="114" displayName="DMU SITE" />
      <concept id="RO132" code="132" displayName="HEALTH AUTHORITY (HA)" />
      <concept id="RO210" code="210" displayName="NHS ENGLAND (REGION, LOCAL OFFICE)" />
      <concept id="RO261" code="261" displayName="STRATEGIC PARTNERSHIP" />
      <concept id="RO157" code="157" displayName="NON-NHS ORGANISATION" />
      <concept id="RO15" code="15" displayName="REG'D UNDER PART 2 CARE STDS ACT 2000" />
      <concept id="RO7" code="7" displayName="HOSPICE" />
      <concept id="RO181" code="181" displayName="PHARMACY HEADQUARTER" />
      <concept id="RO189" code="189" displayName="SPECIAL HEALTH AUTHORITY (SPHA)" />
      <concept id="RO191" code="191" displayName="SPECIAL HEALTH AUTHORITY SITE" />
      <concept id="RO177" code="177" displayName="PRESCRIBING COST CENTRE" />
      <concept id="RO96" code="96" displayName="BRANCH SURGERY" />
      <concept id="RO107" code="107" displayName="CARE TRUST" />
      <concept id="RO108" code="108" displayName="CARE TRUST SITE" />
      <concept id="RO175" code="175" displayName="PRISON" />
      <concept id="RO24" code="24" displayName="NHS TRUST DERIVED" />
      <concept id="RO57" code="57" displayName="FOUNDATION TRUST" />
      <concept id="RO172" code="172" displayName="INDEPENDENT SECTOR HEALTHCARE PROVIDER" />
      <concept id="RO176" code="176" displayName="INDEPENDENT SECTOR H/C PROVIDER SITE" />
      <concept id="RO119" code="119" displayName="LOCAL AUTHORITY - LEGACY" />
      <concept id="RO122" code="122" displayName="LOCAL AUTHORITY SITE - LEGACY" />
      <concept id="RO142" code="142" displayName="LOCAL HEALTH BOARD" />
      <concept id="RO144" code="144" displayName="WELSH LOCAL HEALTH BOARD" />
      <concept id="RO173" code="173" displayName="PATHOLOGY LAB" />
      <concept id="RO31" code="31" displayName="PPA EPACT SYSTEM" />
      <concept id="RO29" code="29" displayName="TREATMENT CENTRE" />
      <concept id="RO268" code="268" displayName="MEDICINE SUPPLIER" />
      <concept id="RO22" code="22" displayName="LEVEL 04 PCT" />
      <concept id="RO166" code="166" displayName="OPTICAL HEADQUARTERS" />
      <concept id="RO167" code="167" displayName="OPTICAL SITE" />
      <concept id="RO126" code="126" displayName="GOVERNMENT DEPARTMENT" />
      <concept id="RO171" code="171" displayName="PRIMARY CARE GROUP" />
      <concept id="RO98" code="98" displayName="CLINICAL COMMISSIONING GROUP" />
      <concept id="RO272" code="272" displayName="PRIMARY CARE NETWORK" />
      <concept id="RO76" code="76" displayName="GP PRACTICE" />
      <concept id="RO109" code="109" displayName="DISTRICT HEALTH AUTHORITY (DHA)" />